id,title,url,headline,instructor,rating,num_reviews,num_subscribers,num_lectures,content_length,level,is_paid,last_update,published_time,image,topic
6465853,Docker for Absolute Beginners – Hands-On DevOps,https://www.udemy.com/course/docker-for-absolute-beginners-hands-on-devops/,"Learn Docker step-by-step with real hands-on labs: images, containers, Dockerfile, CI/CD and deployments for Dev & DevOp",Pankaj Gupta,4.9013205,108,172,60,3.5 hours,Beginner,True,2025-11-25,2025-11-26T09:34:44Z,https://img-c.udemycdn.com/course/240x135/6465853_86bb_3.jpg,docker
3490000,Docker & Kubernetes: The Practical Guide,https://www.udemy.com/course/docker-kubernetes-the-practical-guide/,"Learn Docker, Docker Compose, Multi-Container Projects, Deployment and all about Kubernetes from the ground up!",Academind by Maximilian Schwarzmüller,4.704636,36558,243420,264,23.5 hours,All Levels,True,2026-01-16,2020-10-27T18:25:51Z,https://img-c.udemycdn.com/course/240x135/3490000_d298_2.jpg,docker
1332278,Docker for the Absolute Beginner - Hands On - DevOps,https://www.udemy.com/course/learn-docker/,Learn Docker with Hands On Coding Exercises. For beginners in DevOps,Mumshad Mannambeth,4.6122403,69965,320687,54,4.5 hours,Beginner,True,2024-07-31,2017-09-07T05:52:18Z,https://img-c.udemycdn.com/course/240x135/1332278_4ea6_6.jpg,docker
6643543,"[New] Ultimate Docker Bootcamp for ML, GenAI and Agentic AI",https://www.udemy.com/course/mastering-aiml-with-docker/,"Master Docker for real-world AI & ML workflows — Dockerfiles, Compose, Docker Model Runner, Model Context Protocol (MCP)",Gourav J. Shah,4.625761,182,18200,45,6 hours,Intermediate,True,2025-07-10,2025-05-30T04:57:27Z,https://img-c.udemycdn.com/course/240x135/6643543_0e26_3.jpg,docker
6349863,Fast-Track Docker: Full-Stack App Deployment in 2.5 Days,https://www.udemy.com/course/fast-track-docker/,"Deploy real apps in days, not weeks. Fast-track your Docker & Docker Compose skills from beginner to production-ready.",Jannis Seemann,4.709757,151,1320,102,10 hours,Beginner,True,2025-08-18,2025-07-22T15:02:54Z,https://img-c.udemycdn.com/course/240x135/6349863_b83e_2.jpg,docker
1793828,Docker and Kubernetes: The Complete Guide,https://www.udemy.com/course/docker-and-kubernetes-the-complete-guide/,"Build, test, and deploy Docker applications with Kubernetes while learning production-style development workflows",Stephen Grider,4.721397,62011,328149,311,21.5 hours,All Levels,True,2026-02-03,2018-08-21T14:45:26Z,https://img-c.udemycdn.com/course/240x135/1793828_7999_2.jpg,docker
5740444,"Docker Introduction - Docker, Containers & DevOps - Hands On",https://www.udemy.com/course/diveintodocker/,"Beginner-Friendly Guide to Docker, Docker Desktop, DevOps + More with a Docker Captain, Kubestronaut and CNCF Ambassador",James Spurin (Docker Captain / CNCF Ambassador / Kubestronaut),4.605533,226,5108,23,2 hours,Beginner,True,2025-11-23,2024-02-18T16:50:57Z,https://img-c.udemycdn.com/course/240x135/5740444_8af0_9.jpg,docker
3727932,Working with Docker / OCI Containers using Podman,https://www.udemy.com/course/containers-with-podman/,A deep dive into containers using Podman,Swapnil Jain,4.521574,1086,6369,19,3.5 hours,All Levels,True,2023-03-21,2020-12-31T21:09:41Z,https://img-c.udemycdn.com/course/240x135/3727932_af64_2.jpg,docker
6641607,The Ultimate Docker Masterclass | Beginner to Advanced,https://www.udemy.com/course/docker-mastery-for-beginners-build-ship-deploy-apps/,"Build, Ship, and Deploy with Docker using 40+ Demos, 2 Capstone Projects, Quizzes & Assignments, and 340 Pages PDF Guide",DolfinED Academy,4.796852,37,293,116,15.5 hours,All Levels,True,2026-01-01,2025-06-01T01:04:16Z,https://img-c.udemycdn.com/course/240x135/6641607_f891_5.jpg,docker
1246320,"Supercourse: Docker,Kubernetes, Argo Container Platform 2025",https://www.udemy.com/course/zero-to-docker/,"Containers Supercourse by  School of DevOps® with Production-Grade ArgoCD GitOps, Kubernetes, LinuxWindows, Azure Devops",Gourav J. Shah,4.615694,497,26586,317,39.5 hours,All Levels,True,2025-06-09,2017-06-23T17:29:06Z,https://img-c.udemycdn.com/course/240x135/1246320_64b5_14.jpg,docker
1151632,"Deep Learning A-Z 2026: Neural Networks, AI & ChatGPT Prize",https://www.udemy.com/course/deeplearning/,"Learn to create Deep Learning models in Python from two Machine Learning, Data Science experts. Code templates included.",Kirill Eremenko,4.602203,49234,403694,189,22.5 hours,All Levels,True,2026-01-05,2017-03-28T17:17:56Z,https://img-c.udemycdn.com/course/240x135/1151632_de9b.jpg,deep-learning
6785809,"Deep Learning Specialization: Advanced AI, Hands on Lab",https://www.udemy.com/course/deep-learning-specialization-advanced-ai-architectures/,"Master advanced AI with Deep Learning, Transformers, GANs, RL & real-world deployment skills",Data Science Academy,4.6868095,75,13152,39,4.5 hours,Intermediate,True,2025-08-26,2025-08-24T22:14:13Z,https://img-c.udemycdn.com/course/240x135/6785809_5f88_2.jpg,deep-learning
4033434,"Generative AI, from GANs to CLIP, with Python and Pytorch",https://www.udemy.com/course/generative-creative-ai-from-gans-to-clip-with-python-and-pytorch/,"Learn to code with the most creative and exciting AI architectures, generative AI networks, from basic to advanced",Javier Ideami,4.532972,28257,75061,113,12.5 hours,All Levels,True,2026-02-11,2021-07-17T21:24:31Z,https://img-c.udemycdn.com/course/240x135/4033434_c7a8_3.jpg,deep-learning
2430492,[2026] Tensorflow 2: Deep Learning & Artificial Intelligence,https://www.udemy.com/course/deep-learning-tensorflow-2/,"Machine Learning & Neural Networks for Computer Vision, Time Series Analysis, NLP, GANs, Reinforcement Learning, +More!",Lazy Programmer Inc.,4.728631,14121,64736,146,26 hours,All Levels,True,2026-02-01,2019-08-12T21:46:33Z,https://img-c.udemycdn.com/course/240x135/2430492_5cdb_8.jpg,deep-learning
4221858,A deep understanding of deep learning (with Python intro),https://www.udemy.com/course/deeplearning_x/,"Master deep learning in PyTorch using an experimental scientific approach, with lots of examples and practice problems.",Mike X Cohen,4.8025055,6136,49820,265,57.5 hours,Beginner,True,2026-01-31,2021-08-09T07:58:21Z,https://img-c.udemycdn.com/course/240x135/4221858_0d53_3.jpg,deep-learning
887814,Deep Learning: Recurrent Neural Networks in Python,https://www.udemy.com/course/deep-learning-recurrent-neural-networks-in-python/,"GRU, LSTM, Time Series Forecasting, Stock Predictions, Natural Language Processing (NLP) using Artificial Intelligence",Lazy Programmer Inc.,4.705387,5935,45044,76,13.5 hours,All Levels,True,2026-02-08,2016-07-14T14:37:54Z,https://img-c.udemycdn.com/course/240x135/887814_cf2e_2.jpg,deep-learning
1795952,"The Complete Neural Networks Bootcamp: Theory, Applications",https://www.udemy.com/course/the-complete-neural-networks-bootcamp-theory-applications/,"Deep Learning and Neural Networks Theory and Applications with PyTorch! Including Transformers, BERT and GPT!",Fawaz Sammani,4.4704885,2941,25699,306,44 hours,All Levels,True,2021-11-04,2018-08-11T23:42:44Z,https://img-c.udemycdn.com/course/240x135/1795952_e23e_2.jpg,deep-learning
2373814,PyTorch for Deep Learning with Python Bootcamp,https://www.udemy.com/course/pytorch-for-deep-learning-with-python-bootcamp/,Learn how to create state of the art neural networks for deep learning with Facebook's PyTorch Deep Learning library!,Jose Portilla,4.345741,5536,37897,97,17 hours,All Levels,True,2023-09-19,2019-07-25T16:50:26Z,https://img-c.udemycdn.com/course/240x135/2373814_6e99_2.jpg,deep-learning
1140660,Deep Learning with Python and Keras,https://www.udemy.com/course/deep-learning-with-python-and-keras/,"Understand and build Deep Learning models for images, text  and more using Python and Keras",Data Weekends,4.6091304,3397,25044,148,10 hours,Intermediate,True,2019-08-12,2017-05-11T17:37:03Z,https://img-c.udemycdn.com/course/240x135/1140660_7027_4.jpg,deep-learning
2025244,PyTorch for Deep Learning and Computer Vision,https://www.udemy.com/course/pytorch-for-deep-learning-and-computer-vision/,Build Highly Sophisticated Deep Learning and Computer Vision Applications with PyTorch,Rayan Slim,4.633859,2182,14261,102,14 hours,All Levels,True,2025-12-25,2019-01-31T23:03:15Z,https://img-c.udemycdn.com/course/240x135/2025244_b21e.jpg,deep-learning
4127896,Deep Learning for Beginners: Core Concepts and PyTorch,https://www.udemy.com/course/fundamentals-deep-learning-concept-pytorch/,Get an Intuitive Understanding of Deep Learning and Artificial Intelligence,Seungchan Lee,4.8050385,282,1921,56,9.5 hours,All Levels,True,2024-07-16,2021-07-02T13:53:26Z,https://img-c.udemycdn.com/course/240x135/4127896_5b9d_5.jpg,deep-learning
1647976,Deep Learning: Advanced Natural Language Processing and RNNs,https://www.udemy.com/course/deep-learning-advanced-nlp/,"Natural Language Processing (NLP) with Sequence-to-sequence (seq2seq), Attention, CNNs, RNNs, and Memory Networks!",Lazy Programmer Inc.,4.710424,7412,41805,67,8.5 hours,All Levels,True,2026-02-09,2018-05-17T21:38:11Z,https://img-c.udemycdn.com/course/240x135/1647976_0fdf.jpg,deep-learning
2400948,A Complete Guide on TensorFlow 2.0 using Keras API,https://www.udemy.com/course/tensorflow-2/,Build Amazing Applications of Deep Learning and Artificial Intelligence in TensorFlow 2.0,Hadelin de Ponteves,4.256476,2003,55395,134,13 hours,Beginner,True,2025-09-19,2019-06-23T23:54:52Z,https://img-c.udemycdn.com/course/240x135/2400948_1e87_4.jpg,deep-learning
6874619,Learn To Create A Store Simulator in Unity 6 & C#,https://www.udemy.com/course/unity-store-sim/,Game development made easy. Learn C# using Unity 6 and create your own Store Management game!,James Doyle,4.7462635,71,927,84,13 hours,Beginner,True,2025-10-29,2025-10-23T09:11:33Z,https://img-c.udemycdn.com/course/240x135/6874619_c771_2.jpg,unity
6409533,Unity 6: 2D Game Dev Journey — Junior to Pro,https://www.udemy.com/course/metroidvania-rpg-2d/,Take your C# and Unity 2D knowledge to the next level.,Mario Korov,4.648815,74,782,145,13.5 hours,All Levels,True,2026-01-06,2025-07-08T20:32:21Z,https://img-c.udemycdn.com/course/240x135/6409533_d05b_3.jpg,unity
1178124,Complete C# Unity 3D Game Development in Unity 6,https://www.udemy.com/course/unitycourse2/,Build 5 playable 3D games in Unity 6 using C#. Learn real coding skills and master core game dev techniques.,Rick Davidson,4.7005334,47828,251514,192,27 hours,All Levels,True,2025-12-26,2017-09-27T16:03:29Z,https://img-c.udemycdn.com/course/240x135/1178124_76bb_13.jpg,unity
258316,Complete C# Unity 2D Game Development (Updated To Unity 6),https://www.udemy.com/course/unitycourse/,Build 4 playable 2D games in Unity 6 using C#. Learn real coding skills and master game dev fundamentals.,GameDev.tv Team,4.727824,107533,488325,271,35.5 hours,All Levels,True,2026-02-05,2014-09-03T19:30:05Z,https://img-c.udemycdn.com/course/240x135/258316_55e9_13.jpg,unity
5059176,The Ultimate Guide to Creating an RPG Game in Unity 6,https://www.udemy.com/course/2d-rpg-alexdev/,Level up your  C# and Unity knowledge and create your very own RPG game.,Unity Alex Dev,4.7692237,3664,23260,203,60.5 hours,All Levels,True,2025-09-05,2023-03-23T05:12:26Z,https://img-c.udemycdn.com/course/240x135/5059176_3a43_2.jpg,unity
6899183,Make a Flappy Bird Game From Scratch in Unity 6.3 & C#,https://www.udemy.com/course/flappy-bird-from-scratch-unity6/,Learn the basics of 2D game development in Unity 6.3 by building out a complete game from scratch.,Caroline Middlebrook,4.593696,16,4282,33,2.5 hours,Beginner,True,2025-12-25,2025-12-03T00:30:22Z,https://img-c.udemycdn.com/course/240x135/6899183_aad2_4.jpg,unity
5283178,Lighting in Unity,https://www.udemy.com/course/lighting-in-unity-l/,"Professional lighting for Built in renderer, URP and HDRP",Pete Jepson,4.651029,478,3187,85,13 hours,Beginner,True,2025-06-24,2023-04-22T03:31:22Z,https://img-c.udemycdn.com/course/240x135/5283178_1310.jpg,unity
5455934,The Complete Guide to Unity 3D : Making a Top Down Shooter,https://www.udemy.com/course/3d-tds-alexdev/,Level up your C# and Unity knowledge and create your very own Action-Shooter.,Unity Alex Dev,4.642584,724,5906,260,55 hours,All Levels,True,2026-01-15,2024-02-05T15:46:08Z,https://img-c.udemycdn.com/course/240x135/5455934_cb5b_4.jpg,unity
1691638,Unity C# Scripting : Complete C# For Unity Game Development,https://www.udemy.com/course/unity-c-sharp-scripting/,"Learn C# Scripting for Unity 6 Game Development from Basics, Create your own 3D & 2D Games With Unity & C# ( Unity 6 )",Raja Biswas,4.5870514,2948,18448,149,31 hours,Beginner,True,2025-11-19,2018-07-06T18:18:55Z,https://img-c.udemycdn.com/course/240x135/1691638_5a91_5.jpg,unity
6086911,The Ultimate Guide to Creating a Tower Defense Game in Unity,https://www.udemy.com/course/3d-td-alexdev/,Level up your C# and Unity knowledge and create your very own Tower Defense game.,Unity Alex Dev,4.681075,298,2827,178,46.5 hours,All Levels,True,2026-01-06,2024-12-01T14:28:47Z,https://img-c.udemycdn.com/course/240x135/6086911_3798_4.jpg,unity
4810432,Learn To Create a Card Combat Game With Unity & C#,https://www.udemy.com/course/unity-card-combat/,Game development made easy. Learn C# using Unity and create your own card battling game!,James Doyle,4.674719,470,4379,79,10 hours,Beginner,True,2022-08-15,2022-08-18T21:59:41Z,https://img-c.udemycdn.com/course/240x135/4810432_1a5a_2.jpg,unity
4651280,Unity 3rd Person Combat & Traversal,https://www.udemy.com/course/unity-3rd-person-combat-traversal/,Make a complete 3rd Person Combat System for an RPG in Unity!,GameDev.tv Team,4.6458654,996,7518,66,10 hours,Intermediate,True,2025-11-27,2022-04-27T04:24:49Z,https://img-c.udemycdn.com/course/240x135/4651280_a6ba_3.jpg,unity
793796,Microsoft Excel - Excel from Beginner to Advanced,https://www.udemy.com/course/microsoft-excel-2013-from-beginner-to-advanced-and-beyond/,All-in-One Excel Training: Transform Your Skills with Hands-On Projects and Real-World Applications! - Excel 2007-2025,"Kyle Pew • 2,000,000+ Students",4.670543,523689,1736121,291,21 hours,All Levels,True,2026-02-12,2016-03-16T21:31:03Z,https://img-c.udemycdn.com/course/240x135/793796_0e89_4.jpg,excel
6975605,Microsoft Excel - Beginner to Advanced in only 5 hours,https://www.udemy.com/course/microsoft-excel-beginner-to-advanced-in-only-5-hours/,Complete Excel Training: Transform Your Skills with Hands-On Projects and Real-World Applications! COUPON IN DESCRIPTION,365 Academy,4.6616845,261,759,113,5 hours,All Levels,True,2026-01-31,2025-12-20T09:26:12Z,https://img-c.udemycdn.com/course/240x135/6975605_de12_17.jpg,excel
6807031,EXCEL: Master Microsoft Excel from Basics to Advanced Excel,https://www.udemy.com/course/excel-master-microsoft-excel-from-basics-to-advanced-excel-h/,Ms Excel Complete 4 in 1: Excel Basics I Intermediate Excel I Advanced Microsoft Excel I Expert Excel I Excel Vba,EXCEL: Microsoft Excel Basic to Advanced Excel (data analytics I financial modeling I ms excel I data analyst),4.3667717,167,473,71,13 hours,All Levels,True,2025-11-13,2025-09-08T20:08:04Z,https://img-c.udemycdn.com/course/240x135/6807031_7bbf_3.jpg,excel
6862149,Microsoft Excel: Beginner to Advanced in only 4 hours,https://www.udemy.com/course/microsoft-excel-from-beginner-to-advanced-all-in-one-in-2025/,Complete Excel Training: Transform Your Skills with Hands-On Projects and Real-World Applications! COUPON IN DESCRIPTION,365 Academy,4.639789,119,424,98,4.5 hours,All Levels,True,2026-01-27,2025-10-17T07:17:59Z,https://img-c.udemycdn.com/course/240x135/6862149_cc52_4.jpg,excel
6907089,Excel with AI From Zero to Hero in Data Skills,https://www.udemy.com/course/excel-with-ai-from-zero-to-hero-in-data-skills/,"Master Excel with AI – Learn Data Analysis, Analytics & Visualization through Real-World Projects",Metla Sudha Sekhar,4.364606,38,724,75,7.5 hours,All Levels,True,2025-11-16,2025-11-04T19:15:34Z,https://img-c.udemycdn.com/course/240x135/6907089_4ec3_3.jpg,excel
49250,Learn Microsoft Excel + AI: Go From Beginner to Expert Fast,https://www.udemy.com/course/thebestexcel/,"Excel Made Easy – Microsoft Certified Educator – Microsoft Office Specialist MOS Expert – Fast, Practical, and Fun",Todd McLeod,4.6148167,63846,216692,172,17 hours,All Levels,True,2025-11-21,2013-05-12T17:25:45Z,https://img-c.udemycdn.com/course/240x135/49250_a658_10.jpg,excel
2605732,Zero to Hero in Microsoft Excel: Complete Excel with Copilot,https://www.udemy.com/course/excel-quick-start-guide-from-beginner-to-expert/,"A Beginner's Guide to Microsoft Excel - Learn Excel Charts, Formulas, Pivot tables, Power Query, DAX, Macros and Copilot",Start-Tech Academy,4.5939503,43225,471801,94,10.5 hours,All Levels,True,2026-02-10,2019-10-14T19:10:16Z,https://img-c.udemycdn.com/course/240x135/2605732_e3d5_3.jpg,excel
636822,Microsoft Excel: Data Visualization w/ Excel Charts & Graphs,https://www.udemy.com/course/advanced-excel-charts-graphs/,"Master 20+ Excel charts & graphs, build custom dashboards, and create advanced spreadsheet visuals w/ a top instructor!","Maven Analytics • 1,500,000 Learners",4.6260214,57979,205306,59,4.5 hours,All Levels,True,2025-11-18,2016-07-10T18:12:47Z,https://img-c.udemycdn.com/course/240x135/636822_bb3b_4.jpg,excel
6955815,MICROSOFT EXCEL: Excel From Basic to Advanced Excel (3 IN 1),https://www.udemy.com/course/microsoft-excel-excel-from-basic-to-advanced-excel/,"Ms Excel 3 in 1: learn basic excel, intermediate, advanced microsoft excel, Excel Vba, Data Analysis Excel.","MICROSOFT EXCEL: Excel From Basic to Advanced Excel (Ms Excel, Advanced Microsoft Excel, Excel Vba, Data Analysis)",4.6029077,48,94,35,3 hours,All Levels,True,2026-01-14,2025-12-08T20:48:23Z,https://img-c.udemycdn.com/course/240x135/6955815_7fa5_3.jpg,excel
6859633,Excel for Project Management: Skills Every Manager Needs,https://www.udemy.com/course/excel-for-project-management-skills-every-manager-needs/,"Master Microsoft Excel for Project Management to efficiently track tasks, manage timelines, and control budgets.",Rajan Meena,4.888941,59,247,58,4 hours,Beginner,True,2025-11-11,2025-10-13T07:09:02Z,https://img-c.udemycdn.com/course/240x135/6859633_40f9.jpg,excel
977438,Microsoft Excel: Data Analysis with Excel Pivot Tables,https://www.udemy.com/course/data-analysis-with-excel-pivot-tables/,"Master Excel Pivot Tables for data analysis, EDA & business intelligence. Learn from a top MS Excel instructor!","Maven Analytics • 1,500,000 Learners",4.7211933,76098,283249,90,7 hours,All Levels,True,2025-11-18,2017-01-05T16:30:08Z,https://img-c.udemycdn.com/course/240x135/977438_476d_10.jpg,excel
321410,Beginner to Pro in Excel: Financial Modeling and Valuation,https://www.udemy.com/course/beginner-to-pro-in-excel-financial-modeling-and-valuation/,Financial Modeling in Excel that would allow you to walk into a job and be a rockstar from day one!,365 Careers,4.5476685,60065,252193,374,20.5 hours,All Levels,True,2026-01-03,2014-11-25T23:00:40Z,https://img-c.udemycdn.com/course/240x135/321410_d9c5_4.jpg,excel
756150,Angular - The Complete Guide,https://www.udemy.com/course/the-complete-guide-to-angular-2/,"Master Angular (formerly ""Angular 2"") and build awesome, reactive web apps with the successor of Angular.js",Maximilian Schwarzmüller,4.6898317,221916,851826,762,56 hours,All Levels,True,2026-01-16,2016-02-11T07:29:29Z,https://img-c.udemycdn.com/course/240x135/756150_c033_4.jpg,angular
2023728,Go Java Full Stack with Spring Boot and Angular,https://www.udemy.com/course/full-stack-application-development-with-spring-boot-and-angular/,Become a Full Stack Java Developer. Build Your First Java Full Stack Application with Angular and Spring Boot.,in28Minutes Official,4.453194,11255,90244,179,14 hours,All Levels,True,2026-01-24,2018-11-15T17:31:27Z,https://img-c.udemycdn.com/course/240x135/2023728_2d6d_4.jpg,angular
1885262,Angular Deep Dive - Beginner to Advanced (Angular 21),https://www.udemy.com/course/angular-course/,"Updated To Angular 21 (Angular Signals, defer, @if @for):  Advanced Features of the Angular Core and Common modules",Angular University,4.5056334,11987,60014,113,12 hours,All Levels,True,2026-02-04,2018-11-16T01:36:39Z,https://img-c.udemycdn.com/course/240x135/1885262_b576_3.jpg,angular
833442,Angular & NodeJS - The MEAN Stack Guide,https://www.udemy.com/course/angular-2-and-nodejs-the-practical-guide/,Learn how to connect your Angular Frontend to a NodeJS & Express & MongoDB Backend by building a real Application,Maximilian Schwarzmüller,4.494369,25481,132200,152,12.5 hours,All Levels,True,2025-10-19,2016-05-02T23:09:15Z,https://img-c.udemycdn.com/course/240x135/833442_b26e_5.jpg,angular
6115337,Angular 21 Full Course - Complete Zero to Hero Angular 2026,https://www.udemy.com/course/angular-18-full-course-complete-zero-to-hero-angular-18/,"Angular 21 Mastery: Harness Signals, defer, @if, @for and More for Advanced Core and Common Module Features",Hashmath Rz,4.3512163,443,2127,204,15 hours,All Levels,True,2026-02-12,2024-09-22T07:45:53Z,https://img-c.udemycdn.com/course/240x135/6115337_7ac9_2.jpg,angular
1123098,"Reactive Angular Course (with RxJs, Angular 20)",https://www.udemy.com/course/rxjs-reactive-angular-course/,"Build Angular 19 Applications in Reactive style with plain RxJs - Patterns, Anti-Patterns, Lightweight State Management",Angular University,4.630448,6453,31448,40,5.5 hours,All Levels,True,2026-02-04,2017-04-11T18:48:57Z,https://img-c.udemycdn.com/course/240x135/1123098_8299_3.jpg,angular
1455016,Build an app with ASPNET Core and Angular from scratch,https://www.udemy.com/course/build-an-app-with-aspnet-core-and-angular-from-scratch/,A practical example of how to build an application with ASP.NET Core API and Angular from start to finish,Neil Cummings,4.652078,25317,119022,254,32 hours,Beginner,True,2026-02-07,2017-12-08T00:28:48Z,https://img-c.udemycdn.com/course/240x135/1455016_0b2d_2.jpg,angular
1673770,NgRx (with NgRx Data) - The Complete Guide (Angular 20),https://www.udemy.com/course/ngrx-course/,"Learn the modern NgRx Ecosystem, including NgRx Data, Store, Effects, Router Store, NgRx Entity, and DevTools",Angular University,4.3926587,7583,34399,51,6.5 hours,All Levels,True,2026-02-04,2018-05-30T17:11:13Z,https://img-c.udemycdn.com/course/240x135/1673770_fda4_3.jpg,angular
5908490,Angular Signals In Depth (Angular 21),https://www.udemy.com/course/angular-signals/,Learn how to build modern Angular 21 applications with the new Signals API. Learn common signal-based UI patterns.,Angular University,4.519707,1396,6642,69,7 hours,All Levels,True,2026-02-04,2024-06-05T13:54:23Z,https://img-c.udemycdn.com/course/240x135/5908490_a16b_2.jpg,angular
1247828,The Complete Angular Course: Beginner to Advanced,https://www.udemy.com/course/the-complete-angular-master-class/,"The most comprehensive Angular 4 (Angular 2+) course. Build a real e-commerce app with Angular, Firebase and Bootstrap 4",Mosh Hamedani,4.3246264,28061,119497,376,29.5 hours,All Levels,True,2018-04-25,2017-06-23T00:35:49Z,https://img-c.udemycdn.com/course/240x135/1247828_32bb.jpg,angular
1288304,Angular Forms In Depth (Angular 21),https://www.udemy.com/course/angular-forms-course/,Build complex enterprise data forms with the powerful Angular Forms module,Angular University,4.658168,2511,13830,56,7 hours,All Levels,True,2026-02-04,2017-09-26T21:32:12Z,https://img-c.udemycdn.com/course/240x135/1288304_f084_2.jpg,angular
1633166,Complete Angular 20 - Ultimate Guide - with Real World App,https://www.udemy.com/course/complete-angular-indepth-easy/,"Angular 20, Angular Material, REST API, JWT Authentication, Angular Project, Asp .Net Core, Dashboard",Web Academy by Harsha Vardhan,4.51699,4199,23716,316,48 hours,All Levels,True,2026-02-12,2018-04-06T18:14:26Z,https://img-c.udemycdn.com/course/240x135/1633166_55be.jpg,angular
947098,Understanding TypeScript,https://www.udemy.com/course/understanding-typescript/,"Boost your JavaScript projects with TypeScript: Learn all about core types, generics, TypeScript + React or Node & more!",Maximilian Schwarzmüller,4.646835,57708,281621,339,22.5 hours,All Levels,True,2026-01-06,2016-09-12T17:33:38Z,https://img-c.udemycdn.com/course/240x135/947098_02ec_2.jpg,angular
3387966,TypeScript for Professionals - by Basarat,https://www.udemy.com/course/typescript-for-professionals/,Learn all about the TypeScript type system - taught by a Microsoft MVP,Basarat Ali Syed,4.5258503,4538,19730,75,3.5 hours,Beginner,True,2024-01-18,2020-09-29T23:26:26Z,https://img-c.udemycdn.com/course/240x135/3387966_7b82_2.jpg,typescript
4418914,TypeScript Masterclass 2025 Edition - React + NodeJS Project,https://www.udemy.com/course/typescript-course/,"TypeScript V5 Updated Course - Full Stack Development, TypeScript with ReactJS, ShadcnUI, Node.js, Express and MongoDB.",Manik (Cloudaffle),4.5268407,1180,8494,292,28.5 hours,All Levels,True,2025-03-12,2022-09-27T04:23:06Z,https://img-c.udemycdn.com/course/240x135/4418914_9e62_12.jpg,typescript
4724938,Mastering TypeScript - 2026 Edition,https://www.udemy.com/course/learn-typescript/,Learn the world's fastest growing programming language from scratch. Includes Webpack & React!,Colt Steele,4.608764,6826,36325,151,11 hours,Beginner,True,2026-01-01,2022-06-27T18:39:29Z,https://img-c.udemycdn.com/course/240x135/4724938_ab3d_3.jpg,typescript
3908850,React Testing with Jest / Vitest - TypeScript,https://www.udemy.com/course/typescript-with-react-jest-testing/,"Build React app like a pro with React Testing Library, Jest, Vitest and TypeScript - learn how to write propper tests",Alex Dan,4.2238674,672,78084,59,5 hours,All Levels,True,2026-02-03,2021-03-16T10:07:16Z,https://img-c.udemycdn.com/course/240x135/3908850_7bf2_2.jpg,typescript
